{
  "schema": "ResidualOps_DashboardRefreshFeedbackSummary/v0.1",
  "entry_count": 4,
  "incorporated_count": 1,
  "skipped_missing_artifact_count": 3,
  "pending_with_followup_count": 0,
  "entries": [
    {
      "vertical": "agentsec",
      "reply_id": "feedback-reply-sample-agentsec-v0-1",
      "new_status": "incorporated",
      "follow_up_actions": [],
      "fixture_candidate_added": true,
      "claim_boundary_change_needed": false
    },
    {
      "vertical": "qira",
      "reply_id": "feedback-reply-sample-qira-v0-1",
      "new_status": "skipped_missing_artifact",
      "follow_up_actions": [
        "collect redacted local artifact summary",
        "rerun feedback reply intake after artifact or consent is available",
        "do not execute, post, merge, deploy, publish, upload, train, fetch, or call APIs"
      ],
      "fixture_candidate_added": false,
      "claim_boundary_change_needed": false
    },
    {
      "vertical": "datacapsule",
      "reply_id": "feedback-reply-sample-datacapsule-v0-1",
      "new_status": "skipped_missing_artifact",
      "follow_up_actions": [
        "collect redacted local artifact summary",
        "rerun feedback reply intake after artifact or consent is available",
        "do not execute, post, merge, deploy, publish, upload, train, fetch, or call APIs"
      ],
      "fixture_candidate_added": false,
      "claim_boundary_change_needed": false
    },
    {
      "vertical": "portfolio",
      "reply_id": "feedback-reply-sample-portfolio-v0-1",
      "new_status": "skipped_missing_artifact",
      "follow_up_actions": [
        "collect redacted local artifact summary",
        "rerun feedback reply intake after artifact or consent is available",
        "do not execute, post, merge, deploy, publish, upload, train, fetch, or call APIs"
      ],
      "fixture_candidate_added": false,
      "claim_boundary_change_needed": false
    }
  ],
  "external_action_authorized": false
}
